 `pub_row_index`, `pub_id`, `pub_citation`, `pub_title`, `pub_type`, `pub_link`, `pub_year`, `cohort_year`, `contributor_fids`, `pub_display`,,,,,,,,,,,,1, 'pub_00001',"Maecenas tempor massa ac leo aliquet, et luctus ligula dictum.","Integer at arcu auctor, malesuada lectus ut, porta orci.","Phasellus ac tellus dictum, consectetur felis a, auctor erat.","Integer at arcu auctor, malesuada lectus ut, porta orci.","Phasellus ac tellus dictum, consectetur felis a, auctor erat.","Integer at arcu auctor, malesuada lectus ut, porta orci.","Phasellus ac tellus dictum, consectetur felis a, auctor erat.","Integer at arcu auctor, malesuada lectus ut, porta orci.","Phasellus ac tellus dictum, consectetur felis a, auctor erat.","Integer at arcu auctor, malesuada lectus ut, porta orci.","Phasellus ac tellus dictum, consectetur felis a, auctor erat.","Integer at arcu auctor, malesuada lectus ut, porta orci.","Phasellus ac tellus dictum, consectetur felis a, auctor erat.","Integer at arcu auctor, malesuada lectus ut, porta orci.","Phasellus ac tellus dictum, consectetur felis a, auctor erat.","Integer at arcu auctor, malesuada lectus ut, porta orci.","Phasellus ac tellus dictum, consectetur felis a, auctor erat.","Integer at arcu auctor, malesuada lectus ut, porta orci.","Phasellus ac tellus dictum, consectetur felis a, auctor erat.","Integer at arcu auctor, malesuada lectus ut, porta orci."2, 'pub_00002',Sed pulvinar orci in enim suscipit suscipit.,"Nunc tempus ligula quis purus auctor, at scelerisque ex aliquet.",Sed pulvinar orci in enim suscipit suscipit.,"Nunc tempus ligula quis purus auctor, at scelerisque ex aliquet.",Sed pulvinar orci in enim suscipit suscipit.,"Nunc tempus ligula quis purus auctor, at scelerisque ex aliquet.",Sed pulvinar orci in enim suscipit suscipit.,"Nunc tempus ligula quis purus auctor, at scelerisque ex aliquet.",Sed pulvinar orci in enim suscipit suscipit.,"Nunc tempus ligula quis purus auctor, at scelerisque ex aliquet.",Sed pulvinar orci in enim suscipit suscipit.,"Nunc tempus ligula quis purus auctor, at scelerisque ex aliquet.",Sed pulvinar orci in enim suscipit suscipit.,"Nunc tempus ligula quis purus auctor, at scelerisque ex aliquet.",Sed pulvinar orci in enim suscipit suscipit.,"Nunc tempus ligula quis purus auctor, at scelerisque ex aliquet.",Sed pulvinar orci in enim suscipit suscipit.,"Nunc tempus ligula quis purus auctor, at scelerisque ex aliquet.",Sed pulvinar orci in enim suscipit suscipit.,"Nunc tempus ligula quis purus auctor, at scelerisque ex aliquet."3, 'pub_00003',Donec finibus augue et posuere tincidunt.,Curabitur ultricies magna ut quam congue consectetur.,Donec finibus augue et posuere tincidunt.,Curabitur ultricies magna ut quam congue consectetur.,Donec finibus augue et posuere tincidunt.,Curabitur ultricies magna ut quam congue consectetur.,Donec finibus augue et posuere tincidunt.,Curabitur ultricies magna ut quam congue consectetur.,Donec finibus augue et posuere tincidunt.,Curabitur ultricies magna ut quam congue consectetur.,Donec finibus augue et posuere tincidunt.,Curabitur ultricies magna ut quam congue consectetur.,Donec finibus augue et posuere tincidunt.,Curabitur ultricies magna ut quam congue consectetur.,Donec finibus augue et posuere tincidunt.,Curabitur ultricies magna ut quam congue consectetur.,Donec finibus augue et posuere tincidunt.,Curabitur ultricies magna ut quam congue consectetur.,Donec finibus augue et posuere tincidunt.,Curabitur ultricies magna ut quam congue consectetur.4, 'pub_00004',"Maecenas tempus nisl efficitur, mattis diam a, egestas purus.","Duis vehicula nisi vitae nibh tincidunt, vulputate iaculis orci ullamcorper.","Maecenas tempus nisl efficitur, mattis diam a, egestas purus.","Duis vehicula nisi vitae nibh tincidunt, vulputate iaculis orci ullamcorper.","Maecenas tempus nisl efficitur, mattis diam a, egestas purus.","Duis vehicula nisi vitae nibh tincidunt, vulputate iaculis orci ullamcorper.","Maecenas tempus nisl efficitur, mattis diam a, egestas purus.","Duis vehicula nisi vitae nibh tincidunt, vulputate iaculis orci ullamcorper.","Maecenas tempus nisl efficitur, mattis diam a, egestas purus.","Duis vehicula nisi vitae nibh tincidunt, vulputate iaculis orci ullamcorper.","Maecenas tempus nisl efficitur, mattis diam a, egestas purus.","Duis vehicula nisi vitae nibh tincidunt, vulputate iaculis orci ullamcorper.","Maecenas tempus nisl efficitur, mattis diam a, egestas purus.","Duis vehicula nisi vitae nibh tincidunt, vulputate iaculis orci ullamcorper.","Maecenas tempus nisl efficitur, mattis diam a, egestas purus.","Duis vehicula nisi vitae nibh tincidunt, vulputate iaculis orci ullamcorper.","Maecenas tempus nisl efficitur, mattis diam a, egestas purus.","Duis vehicula nisi vitae nibh tincidunt, vulputate iaculis orci ullamcorper.","Maecenas tempus nisl efficitur, mattis diam a, egestas purus.","Duis vehicula nisi vitae nibh tincidunt, vulputate iaculis orci ullamcorper."5, 'pub_00005',Vestibulum vel ante sagittis magna pellentesque condimentum.,Nunc tristique tortor vitae condimentum placerat.,Vestibulum vel ante sagittis magna pellentesque condimentum.,Nunc tristique tortor vitae condimentum placerat.,Vestibulum vel ante sagittis magna pellentesque condimentum.,Nunc tristique tortor vitae condimentum placerat.,Vestibulum vel ante sagittis magna pellentesque condimentum.,Nunc tristique tortor vitae condimentum placerat.,Vestibulum vel ante sagittis magna pellentesque condimentum.,Nunc tristique tortor vitae condimentum placerat.,Vestibulum vel ante sagittis magna pellentesque condimentum.,Nunc tristique tortor vitae condimentum placerat.,Vestibulum vel ante sagittis magna pellentesque condimentum.,Nunc tristique tortor vitae condimentum placerat.,Vestibulum vel ante sagittis magna pellentesque condimentum.,Nunc tristique tortor vitae condimentum placerat.,Vestibulum vel ante sagittis magna pellentesque condimentum.,Nunc tristique tortor vitae condimentum placerat.,Vestibulum vel ante sagittis magna pellentesque condimentum.,Nunc tristique tortor vitae condimentum placerat.6, 'pub_00006',Nam pharetra ex eget pellentesque semper.,Quisque suscipit nunc a augue varius elementum.,Nam pharetra ex eget pellentesque semper.,Quisque suscipit nunc a augue varius elementum.,Nam pharetra ex eget pellentesque semper.,Quisque suscipit nunc a augue varius elementum.,Nam pharetra ex eget pellentesque semper.,Quisque suscipit nunc a augue varius elementum.,Nam pharetra ex eget pellentesque semper.,Quisque suscipit nunc a augue varius elementum.,Nam pharetra ex eget pellentesque semper.,Quisque suscipit nunc a augue varius elementum.,Nam pharetra ex eget pellentesque semper.,Quisque suscipit nunc a augue varius elementum.,Nam pharetra ex eget pellentesque semper.,Quisque suscipit nunc a augue varius elementum.,Nam pharetra ex eget pellentesque semper.,Quisque suscipit nunc a augue varius elementum.,Nam pharetra ex eget pellentesque semper.,Quisque suscipit nunc a augue varius elementum.7, 'pub_00007',Nullam at tellus ac lorem convallis vehicula.,Proin ac tortor sed neque feugiat hendrerit ac consectetur urna.,Nullam at tellus ac lorem convallis vehicula.,Proin ac tortor sed neque feugiat hendrerit ac consectetur urna.,Nullam at tellus ac lorem convallis vehicula.,Proin ac tortor sed neque feugiat hendrerit ac consectetur urna.,Nullam at tellus ac lorem convallis vehicula.,Proin ac tortor sed neque feugiat hendrerit ac consectetur urna.,Nullam at tellus ac lorem convallis vehicula.,Proin ac tortor sed neque feugiat hendrerit ac consectetur urna.,Nullam at tellus ac lorem convallis vehicula.,Proin ac tortor sed neque feugiat hendrerit ac consectetur urna.,Nullam at tellus ac lorem convallis vehicula.,Proin ac tortor sed neque feugiat hendrerit ac consectetur urna.,Nullam at tellus ac lorem convallis vehicula.,Proin ac tortor sed neque feugiat hendrerit ac consectetur urna.,Nullam at tellus ac lorem convallis vehicula.,Proin ac tortor sed neque feugiat hendrerit ac consectetur urna.,Nullam at tellus ac lorem convallis vehicula.,Proin ac tortor sed neque feugiat hendrerit ac consectetur urna.8, 'pub_00008',Phasellus a augue ut nibh molestie fermentum in eget eros.,Sed vel lectus ut arcu aliquam fringilla.,"Maecenas tempor massa ac leo aliquet, et luctus ligula dictum.",Sed vel lectus ut arcu aliquam fringilla.,"Maecenas tempor massa ac leo aliquet, et luctus ligula dictum.",Sed vel lectus ut arcu aliquam fringilla.,"Maecenas tempor massa ac leo aliquet, et luctus ligula dictum.",Sed vel lectus ut arcu aliquam fringilla.,"Maecenas tempor massa ac leo aliquet, et luctus ligula dictum.",Sed vel lectus ut arcu aliquam fringilla.,"Maecenas tempor massa ac leo aliquet, et luctus ligula dictum.",Sed vel lectus ut arcu aliquam fringilla.,"Maecenas tempor massa ac leo aliquet, et luctus ligula dictum.",Sed vel lectus ut arcu aliquam fringilla.,"Maecenas tempor massa ac leo aliquet, et luctus ligula dictum.",Sed vel lectus ut arcu aliquam fringilla.,"Maecenas tempor massa ac leo aliquet, et luctus ligula dictum.",Sed vel lectus ut arcu aliquam fringilla.,"Maecenas tempor massa ac leo aliquet, et luctus ligula dictum.",Sed vel lectus ut arcu aliquam fringilla.9, 'pub_00009',"Vestibulum mattis dui ut urna mattis, in interdum dui bibendum.",Curabitur cursus elit in lobortis accumsan.,"Vestibulum mattis dui ut urna mattis, in interdum dui bibendum.",Curabitur cursus elit in lobortis accumsan.,"Vestibulum mattis dui ut urna mattis, in interdum dui bibendum.",Curabitur cursus elit in lobortis accumsan.,"Vestibulum mattis dui ut urna mattis, in interdum dui bibendum.",Curabitur cursus elit in lobortis accumsan.,"Vestibulum mattis dui ut urna mattis, in interdum dui bibendum.",Curabitur cursus elit in lobortis accumsan.,"Vestibulum mattis dui ut urna mattis, in interdum dui bibendum.",Curabitur cursus elit in lobortis accumsan.,"Vestibulum mattis dui ut urna mattis, in interdum dui bibendum.",Curabitur cursus elit in lobortis accumsan.,"Vestibulum mattis dui ut urna mattis, in interdum dui bibendum.",Curabitur cursus elit in lobortis accumsan.,"Vestibulum mattis dui ut urna mattis, in interdum dui bibendum.",Curabitur cursus elit in lobortis accumsan.,"Vestibulum mattis dui ut urna mattis, in interdum dui bibendum.",Curabitur cursus elit in lobortis accumsan.10, 'pub_00010',"Aliquam in augue eleifend, blandit nisi eget, feugiat neque.","Proin a erat posuere, imperdiet dui ut, egestas mauris.","Aliquam in augue eleifend, blandit nisi eget, feugiat neque.","Proin a erat posuere, imperdiet dui ut, egestas mauris.","Aliquam in augue eleifend, blandit nisi eget, feugiat neque.","Proin a erat posuere, imperdiet dui ut, egestas mauris.","Aliquam in augue eleifend, blandit nisi eget, feugiat neque.","Proin a erat posuere, imperdiet dui ut, egestas mauris.","Aliquam in augue eleifend, blandit nisi eget, feugiat neque.","Proin a erat posuere, imperdiet dui ut, egestas mauris.","Aliquam in augue eleifend, blandit nisi eget, feugiat neque.","Proin a erat posuere, imperdiet dui ut, egestas mauris.","Aliquam in augue eleifend, blandit nisi eget, feugiat neque.","Proin a erat posuere, imperdiet dui ut, egestas mauris.","Aliquam in augue eleifend, blandit nisi eget, feugiat neque.","Proin a erat posuere, imperdiet dui ut, egestas mauris.","Aliquam in augue eleifend, blandit nisi eget, feugiat neque.","Proin a erat posuere, imperdiet dui ut, egestas mauris.","Aliquam in augue eleifend, blandit nisi eget, feugiat neque.","Proin a erat posuere, imperdiet dui ut, egestas mauris."11, 'pub_00011',Ut in elit lobortis turpis cursus tristique eu in velit.,Vivamus condimentum eros convallis est vehicula placerat.,Ut in elit lobortis turpis cursus tristique eu in velit.,Vivamus condimentum eros convallis est vehicula placerat.,Ut in elit lobortis turpis cursus tristique eu in velit.,Vivamus condimentum eros convallis est vehicula placerat.,Ut in elit lobortis turpis cursus tristique eu in velit.,Vivamus condimentum eros convallis est vehicula placerat.,Ut in elit lobortis turpis cursus tristique eu in velit.,Vivamus condimentum eros convallis est vehicula placerat.,Ut in elit lobortis turpis cursus tristique eu in velit.,Vivamus condimentum eros convallis est vehicula placerat.,Ut in elit lobortis turpis cursus tristique eu in velit.,Vivamus condimentum eros convallis est vehicula placerat.,Ut in elit lobortis turpis cursus tristique eu in velit.,Vivamus condimentum eros convallis est vehicula placerat.,Ut in elit lobortis turpis cursus tristique eu in velit.,Vivamus condimentum eros convallis est vehicula placerat.,Ut in elit lobortis turpis cursus tristique eu in velit.,Vivamus condimentum eros convallis est vehicula placerat.12, 'pub_00012',Ut in enim eget risus mollis maximus vitae id dolor.,Ut id libero vel diam consequat mollis.,Ut in enim eget risus mollis maximus vitae id dolor.,Ut id libero vel diam consequat mollis.,Ut in enim eget risus mollis maximus vitae id dolor.,Ut id libero vel diam consequat mollis.,Ut in enim eget risus mollis maximus vitae id dolor.,Ut id libero vel diam consequat mollis.,Ut in enim eget risus mollis maximus vitae id dolor.,Ut id libero vel diam consequat mollis.,Ut in enim eget risus mollis maximus vitae id dolor.,Ut id libero vel diam consequat mollis.,Ut in enim eget risus mollis maximus vitae id dolor.,Ut id libero vel diam consequat mollis.,Ut in enim eget risus mollis maximus vitae id dolor.,Ut id libero vel diam consequat mollis.,Ut in enim eget risus mollis maximus vitae id dolor.,Ut id libero vel diam consequat mollis.,Ut in enim eget risus mollis maximus vitae id dolor.,Ut id libero vel diam consequat mollis.13, 'pub_00013',Phasellus maximus sapien mattis sapien porta placerat.,"Nam vel lacus egestas, accumsan lacus at, porttitor nisl.",Phasellus maximus sapien mattis sapien porta placerat.,"Nam vel lacus egestas, accumsan lacus at, porttitor nisl.",Phasellus maximus sapien mattis sapien porta placerat.,"Nam vel lacus egestas, accumsan lacus at, porttitor nisl.",Phasellus maximus sapien mattis sapien porta placerat.,"Nam vel lacus egestas, accumsan lacus at, porttitor nisl.",Phasellus maximus sapien mattis sapien porta placerat.,"Nam vel lacus egestas, accumsan lacus at, porttitor nisl.",Phasellus maximus sapien mattis sapien porta placerat.,"Nam vel lacus egestas, accumsan lacus at, porttitor nisl.",Phasellus maximus sapien mattis sapien porta placerat.,"Nam vel lacus egestas, accumsan lacus at, porttitor nisl.",Phasellus maximus sapien mattis sapien porta placerat.,"Nam vel lacus egestas, accumsan lacus at, porttitor nisl.",Phasellus maximus sapien mattis sapien porta placerat.,"Nam vel lacus egestas, accumsan lacus at, porttitor nisl.",Phasellus maximus sapien mattis sapien porta placerat.,"Nam vel lacus egestas, accumsan lacus at, porttitor nisl."14, 'pub_00014',"Cras rhoncus odio non enim eleifend, vel tempor ante feugiat.",Etiam vulputate ante consectetur ullamcorper molestie.,"Cras rhoncus odio non enim eleifend, vel tempor ante feugiat.",Etiam vulputate ante consectetur ullamcorper molestie.,"Cras rhoncus odio non enim eleifend, vel tempor ante feugiat.",Etiam vulputate ante consectetur ullamcorper molestie.,"Cras rhoncus odio non enim eleifend, vel tempor ante feugiat.",Etiam vulputate ante consectetur ullamcorper molestie.,"Cras rhoncus odio non enim eleifend, vel tempor ante feugiat.",Etiam vulputate ante consectetur ullamcorper molestie.,"Cras rhoncus odio non enim eleifend, vel tempor ante feugiat.",Etiam vulputate ante consectetur ullamcorper molestie.,"Cras rhoncus odio non enim eleifend, vel tempor ante feugiat.",Etiam vulputate ante consectetur ullamcorper molestie.,"Cras rhoncus odio non enim eleifend, vel tempor ante feugiat.",Etiam vulputate ante consectetur ullamcorper molestie.,"Cras rhoncus odio non enim eleifend, vel tempor ante feugiat.",Etiam vulputate ante consectetur ullamcorper molestie.,"Cras rhoncus odio non enim eleifend, vel tempor ante feugiat.",Etiam vulputate ante consectetur ullamcorper molestie.15, 'pub_00015',Ut feugiat purus vel nisl vehicula feugiat.,Proin quis nisl id ante convallis hendrerit in in enim.,Ut feugiat purus vel nisl vehicula feugiat.,Proin quis nisl id ante convallis hendrerit in in enim.,Ut feugiat purus vel nisl vehicula feugiat.,Proin quis nisl id ante convallis hendrerit in in enim.,Ut feugiat purus vel nisl vehicula feugiat.,Proin quis nisl id ante convallis hendrerit in in enim.,Ut feugiat purus vel nisl vehicula feugiat.,Proin quis nisl id ante convallis hendrerit in in enim.,Ut feugiat purus vel nisl vehicula feugiat.,Proin quis nisl id ante convallis hendrerit in in enim.,Ut feugiat purus vel nisl vehicula feugiat.,Proin quis nisl id ante convallis hendrerit in in enim.,Ut feugiat purus vel nisl vehicula feugiat.,Proin quis nisl id ante convallis hendrerit in in enim.,Ut feugiat purus vel nisl vehicula feugiat.,Proin quis nisl id ante convallis hendrerit in in enim.,Ut feugiat purus vel nisl vehicula feugiat.,Proin quis nisl id ante convallis hendrerit in in enim.16, 'pub_00016',Donec eget odio sit amet ligula maximus rhoncus ac quis ante.,"Aliquam a nulla suscipit, scelerisque odio nec, dapibus turpis.",Donec eget odio sit amet ligula maximus rhoncus ac quis ante.,"Aliquam a nulla suscipit, scelerisque odio nec, dapibus turpis.",Donec eget odio sit amet ligula maximus rhoncus ac quis ante.,"Aliquam a nulla suscipit, scelerisque odio nec, dapibus turpis.",Donec eget odio sit amet ligula maximus rhoncus ac quis ante.,"Aliquam a nulla suscipit, scelerisque odio nec, dapibus turpis.",Donec eget odio sit amet ligula maximus rhoncus ac quis ante.,"Aliquam a nulla suscipit, scelerisque odio nec, dapibus turpis.",Donec eget odio sit amet ligula maximus rhoncus ac quis ante.,"Aliquam a nulla suscipit, scelerisque odio nec, dapibus turpis.",Donec eget odio sit amet ligula maximus rhoncus ac quis ante.,"Aliquam a nulla suscipit, scelerisque odio nec, dapibus turpis.",Donec eget odio sit amet ligula maximus rhoncus ac quis ante.,"Aliquam a nulla suscipit, scelerisque odio nec, dapibus turpis.",Donec eget odio sit amet ligula maximus rhoncus ac quis ante.,"Aliquam a nulla suscipit, scelerisque odio nec, dapibus turpis.",Donec eget odio sit amet ligula maximus rhoncus ac quis ante.,"Aliquam a nulla suscipit, scelerisque odio nec, dapibus turpis."17, 'pub_00017',"Cras posuere odio sed felis tristique, interdum egestas quam dictum.",Suspendisse iaculis risus in tincidunt dignissim.,"Cras posuere odio sed felis tristique, interdum egestas quam dictum.",Suspendisse iaculis risus in tincidunt dignissim.,"Cras posuere odio sed felis tristique, interdum egestas quam dictum.",Suspendisse iaculis risus in tincidunt dignissim.,"Cras posuere odio sed felis tristique, interdum egestas quam dictum.",Suspendisse iaculis risus in tincidunt dignissim.,"Cras posuere odio sed felis tristique, interdum egestas quam dictum.",Suspendisse iaculis risus in tincidunt dignissim.,"Cras posuere odio sed felis tristique, interdum egestas quam dictum.",Suspendisse iaculis risus in tincidunt dignissim.,"Cras posuere odio sed felis tristique, interdum egestas quam dictum.",Suspendisse iaculis risus in tincidunt dignissim.,"Cras posuere odio sed felis tristique, interdum egestas quam dictum.",Suspendisse iaculis risus in tincidunt dignissim.,"Cras posuere odio sed felis tristique, interdum egestas quam dictum.",Suspendisse iaculis risus in tincidunt dignissim.,"Cras posuere odio sed felis tristique, interdum egestas quam dictum.",Suspendisse iaculis risus in tincidunt dignissim.18, 'pub_00018',Sed pharetra nisi a pulvinar pretium.,"Morbi venenatis turpis a diam volutpat, in elementum mauris euismod.",Sed pharetra nisi a pulvinar pretium.,"Morbi venenatis turpis a diam volutpat, in elementum mauris euismod.",Sed pharetra nisi a pulvinar pretium.,"Morbi venenatis turpis a diam volutpat, in elementum mauris euismod.",Sed pharetra nisi a pulvinar pretium.,"Morbi venenatis turpis a diam volutpat, in elementum mauris euismod.",Sed pharetra nisi a pulvinar pretium.,"Morbi venenatis turpis a diam volutpat, in elementum mauris euismod.",Sed pharetra nisi a pulvinar pretium.,"Morbi venenatis turpis a diam volutpat, in elementum mauris euismod.",Sed pharetra nisi a pulvinar pretium.,"Morbi venenatis turpis a diam volutpat, in elementum mauris euismod.",Sed pharetra nisi a pulvinar pretium.,"Morbi venenatis turpis a diam volutpat, in elementum mauris euismod.",Sed pharetra nisi a pulvinar pretium.,"Morbi venenatis turpis a diam volutpat, in elementum mauris euismod.",Sed pharetra nisi a pulvinar pretium.,"Morbi venenatis turpis a diam volutpat, in elementum mauris euismod."19, 'pub_00019',Ut at sapien gravida lacus consectetur scelerisque.,Vivamus sagittis neque id dolor egestas malesuada.,Ut at sapien gravida lacus consectetur scelerisque.,Vivamus sagittis neque id dolor egestas malesuada.,Ut at sapien gravida lacus consectetur scelerisque.,Vivamus sagittis neque id dolor egestas malesuada.,Ut at sapien gravida lacus consectetur scelerisque.,Vivamus sagittis neque id dolor egestas malesuada.,Ut at sapien gravida lacus consectetur scelerisque.,Vivamus sagittis neque id dolor egestas malesuada.,Ut at sapien gravida lacus consectetur scelerisque.,Vivamus sagittis neque id dolor egestas malesuada.,Ut at sapien gravida lacus consectetur scelerisque.,Vivamus sagittis neque id dolor egestas malesuada.,Ut at sapien gravida lacus consectetur scelerisque.,Vivamus sagittis neque id dolor egestas malesuada.,Ut at sapien gravida lacus consectetur scelerisque.,Vivamus sagittis neque id dolor egestas malesuada.,Ut at sapien gravida lacus consectetur scelerisque.,Vivamus sagittis neque id dolor egestas malesuada.20, 'pub_00020',"Suspendisse vitae sem dignissim, porta velit id, dapibus enim.","Quisque aliquam dolor at dolor sollicitudin, sed pretium diam semper.","Suspendisse vitae sem dignissim, porta velit id, dapibus enim.","Quisque aliquam dolor at dolor sollicitudin, sed pretium diam semper.","Suspendisse vitae sem dignissim, porta velit id, dapibus enim.","Quisque aliquam dolor at dolor sollicitudin, sed pretium diam semper.","Suspendisse vitae sem dignissim, porta velit id, dapibus enim.","Quisque aliquam dolor at dolor sollicitudin, sed pretium diam semper.","Suspendisse vitae sem dignissim, porta velit id, dapibus enim.","Quisque aliquam dolor at dolor sollicitudin, sed pretium diam semper.","Suspendisse vitae sem dignissim, porta velit id, dapibus enim.","Quisque aliquam dolor at dolor sollicitudin, sed pretium diam semper.","Suspendisse vitae sem dignissim, porta velit id, dapibus enim.","Quisque aliquam dolor at dolor sollicitudin, sed pretium diam semper.","Suspendisse vitae sem dignissim, porta velit id, dapibus enim.","Quisque aliquam dolor at dolor sollicitudin, sed pretium diam semper.","Suspendisse vitae sem dignissim, porta velit id, dapibus enim.","Quisque aliquam dolor at dolor sollicitudin, sed pretium diam semper.","Suspendisse vitae sem dignissim, porta velit id, dapibus enim.","Quisque aliquam dolor at dolor sollicitudin, sed pretium diam semper."21, 'pub_00021',"Sed blandit ipsum eget dui ullamcorper, nec auctor ex posuere.",Quisque et massa id elit efficitur dignissim.,"Sed blandit ipsum eget dui ullamcorper, nec auctor ex posuere.",Quisque et massa id elit efficitur dignissim.,"Sed blandit ipsum eget dui ullamcorper, nec auctor ex posuere.",Quisque et massa id elit efficitur dignissim.,"Sed blandit ipsum eget dui ullamcorper, nec auctor ex posuere.",Quisque et massa id elit efficitur dignissim.,"Sed blandit ipsum eget dui ullamcorper, nec auctor ex posuere.",Quisque et massa id elit efficitur dignissim.,"Sed blandit ipsum eget dui ullamcorper, nec auctor ex posuere.",Quisque et massa id elit efficitur dignissim.,"Sed blandit ipsum eget dui ullamcorper, nec auctor ex posuere.",Quisque et massa id elit efficitur dignissim.,"Sed blandit ipsum eget dui ullamcorper, nec auctor ex posuere.",Quisque et massa id elit efficitur dignissim.,"Sed blandit ipsum eget dui ullamcorper, nec auctor ex posuere.",Quisque et massa id elit efficitur dignissim.,"Sed blandit ipsum eget dui ullamcorper, nec auctor ex posuere.",Quisque et massa id elit efficitur dignissim.22, 'pub_00022',Phasellus vitae urna id mauris rutrum aliquam fermentum sed nibh.,"Suspendisse consectetur ante non dui volutpat, efficitur mollis mauris eleifend.",Phasellus vitae urna id mauris rutrum aliquam fermentum sed nibh.,"Suspendisse consectetur ante non dui volutpat, efficitur mollis mauris eleifend.",Phasellus vitae urna id mauris rutrum aliquam fermentum sed nibh.,"Suspendisse consectetur ante non dui volutpat, efficitur mollis mauris eleifend.",Phasellus vitae urna id mauris rutrum aliquam fermentum sed nibh.,"Suspendisse consectetur ante non dui volutpat, efficitur mollis mauris eleifend.",Phasellus vitae urna id mauris rutrum aliquam fermentum sed nibh.,"Suspendisse consectetur ante non dui volutpat, efficitur mollis mauris eleifend.",Phasellus vitae urna id mauris rutrum aliquam fermentum sed nibh.,"Suspendisse consectetur ante non dui volutpat, efficitur mollis mauris eleifend.",Phasellus vitae urna id mauris rutrum aliquam fermentum sed nibh.,"Suspendisse consectetur ante non dui volutpat, efficitur mollis mauris eleifend.",Phasellus vitae urna id mauris rutrum aliquam fermentum sed nibh.,"Suspendisse consectetur ante non dui volutpat, efficitur mollis mauris eleifend.",Phasellus vitae urna id mauris rutrum aliquam fermentum sed nibh.,"Suspendisse consectetur ante non dui volutpat, efficitur mollis mauris eleifend.",Phasellus vitae urna id mauris rutrum aliquam fermentum sed nibh.,"Suspendisse consectetur ante non dui volutpat, efficitur mollis mauris eleifend."