 `pub_row_index`, `pub_id`, `pub_citation`, `pub_title`, `pub_type`, `pub_link`, `pub_year`, `cohort_year`, `contributor_fids`, `pub_display`,,,,,,,,,,,,67, 'pub_00067',Duis ornare elit nec consectetur laoreet.,"Pellentesque egestas enim lacinia, porta quam lacinia, pretium turpis.",Duis ornare elit nec consectetur laoreet.,"Pellentesque egestas enim lacinia, porta quam lacinia, pretium turpis.",Duis ornare elit nec consectetur laoreet.,"Pellentesque egestas enim lacinia, porta quam lacinia, pretium turpis.",Duis ornare elit nec consectetur laoreet.,"Pellentesque egestas enim lacinia, porta quam lacinia, pretium turpis.",Duis ornare elit nec consectetur laoreet.,"Pellentesque egestas enim lacinia, porta quam lacinia, pretium turpis.",Duis ornare elit nec consectetur laoreet.,"Pellentesque egestas enim lacinia, porta quam lacinia, pretium turpis.",Duis ornare elit nec consectetur laoreet.,"Pellentesque egestas enim lacinia, porta quam lacinia, pretium turpis.",Duis ornare elit nec consectetur laoreet.,"Pellentesque egestas enim lacinia, porta quam lacinia, pretium turpis.",Duis ornare elit nec consectetur laoreet.,"Pellentesque egestas enim lacinia, porta quam lacinia, pretium turpis.",Duis ornare elit nec consectetur laoreet.,"Pellentesque egestas enim lacinia, porta quam lacinia, pretium turpis."68, 'pub_00068',Vestibulum quis erat eget dolor venenatis pretium semper sit amet est.,Maecenas laoreet mauris lobortis elit facilisis ultrices.,Vestibulum quis erat eget dolor venenatis pretium semper sit amet est.,Maecenas laoreet mauris lobortis elit facilisis ultrices.,Vestibulum quis erat eget dolor venenatis pretium semper sit amet est.,Maecenas laoreet mauris lobortis elit facilisis ultrices.,Vestibulum quis erat eget dolor venenatis pretium semper sit amet est.,Maecenas laoreet mauris lobortis elit facilisis ultrices.,Vestibulum quis erat eget dolor venenatis pretium semper sit amet est.,Maecenas laoreet mauris lobortis elit facilisis ultrices.,Vestibulum quis erat eget dolor venenatis pretium semper sit amet est.,Maecenas laoreet mauris lobortis elit facilisis ultrices.,Vestibulum quis erat eget dolor venenatis pretium semper sit amet est.,Maecenas laoreet mauris lobortis elit facilisis ultrices.,Vestibulum quis erat eget dolor venenatis pretium semper sit amet est.,Maecenas laoreet mauris lobortis elit facilisis ultrices.,Vestibulum quis erat eget dolor venenatis pretium semper sit amet est.,Maecenas laoreet mauris lobortis elit facilisis ultrices.,Vestibulum quis erat eget dolor venenatis pretium semper sit amet est.,Maecenas laoreet mauris lobortis elit facilisis ultrices.69, 'pub_00069',"Pellentesque gravida ex vitae libero molestie, sed ullamcorper mi luctus.","Aliquam accumsan odio at justo porttitor, vitae malesuada lorem iaculis.","Pellentesque gravida ex vitae libero molestie, sed ullamcorper mi luctus.","Aliquam accumsan odio at justo porttitor, vitae malesuada lorem iaculis.","Pellentesque gravida ex vitae libero molestie, sed ullamcorper mi luctus.","Aliquam accumsan odio at justo porttitor, vitae malesuada lorem iaculis.","Pellentesque gravida ex vitae libero molestie, sed ullamcorper mi luctus.","Aliquam accumsan odio at justo porttitor, vitae malesuada lorem iaculis.","Pellentesque gravida ex vitae libero molestie, sed ullamcorper mi luctus.","Aliquam accumsan odio at justo porttitor, vitae malesuada lorem iaculis.","Pellentesque gravida ex vitae libero molestie, sed ullamcorper mi luctus.","Aliquam accumsan odio at justo porttitor, vitae malesuada lorem iaculis.","Pellentesque gravida ex vitae libero molestie, sed ullamcorper mi luctus.","Aliquam accumsan odio at justo porttitor, vitae malesuada lorem iaculis.","Pellentesque gravida ex vitae libero molestie, sed ullamcorper mi luctus.","Aliquam accumsan odio at justo porttitor, vitae malesuada lorem iaculis.","Pellentesque gravida ex vitae libero molestie, sed ullamcorper mi luctus.","Aliquam accumsan odio at justo porttitor, vitae malesuada lorem iaculis.","Pellentesque gravida ex vitae libero molestie, sed ullamcorper mi luctus.","Aliquam accumsan odio at justo porttitor, vitae malesuada lorem iaculis."70, 'pub_00070',"Curabitur euismod elit id lectus volutpat, quis elementum sapien bibendum.","Praesent id urna lacinia, eleifend massa et, consequat ex.","Curabitur euismod elit id lectus volutpat, quis elementum sapien bibendum.","Praesent id urna lacinia, eleifend massa et, consequat ex.","Curabitur euismod elit id lectus volutpat, quis elementum sapien bibendum.","Praesent id urna lacinia, eleifend massa et, consequat ex.","Curabitur euismod elit id lectus volutpat, quis elementum sapien bibendum.","Praesent id urna lacinia, eleifend massa et, consequat ex.","Curabitur euismod elit id lectus volutpat, quis elementum sapien bibendum.","Praesent id urna lacinia, eleifend massa et, consequat ex.","Curabitur euismod elit id lectus volutpat, quis elementum sapien bibendum.","Praesent id urna lacinia, eleifend massa et, consequat ex.","Curabitur euismod elit id lectus volutpat, quis elementum sapien bibendum.","Praesent id urna lacinia, eleifend massa et, consequat ex.","Curabitur euismod elit id lectus volutpat, quis elementum sapien bibendum.","Praesent id urna lacinia, eleifend massa et, consequat ex.","Curabitur euismod elit id lectus volutpat, quis elementum sapien bibendum.","Praesent id urna lacinia, eleifend massa et, consequat ex.","Curabitur euismod elit id lectus volutpat, quis elementum sapien bibendum.","Praesent id urna lacinia, eleifend massa et, consequat ex."71, 'pub_00072',In efficitur nulla nec suscipit dapibus.,Donec at quam et nunc suscipit imperdiet vel molestie orci.,In efficitur nulla nec suscipit dapibus.,Donec at quam et nunc suscipit imperdiet vel molestie orci.,In efficitur nulla nec suscipit dapibus.,Donec at quam et nunc suscipit imperdiet vel molestie orci.,In efficitur nulla nec suscipit dapibus.,Donec at quam et nunc suscipit imperdiet vel molestie orci.,In efficitur nulla nec suscipit dapibus.,Donec at quam et nunc suscipit imperdiet vel molestie orci.,In efficitur nulla nec suscipit dapibus.,Donec at quam et nunc suscipit imperdiet vel molestie orci.,In efficitur nulla nec suscipit dapibus.,Donec at quam et nunc suscipit imperdiet vel molestie orci.,In efficitur nulla nec suscipit dapibus.,Donec at quam et nunc suscipit imperdiet vel molestie orci.,In efficitur nulla nec suscipit dapibus.,Donec at quam et nunc suscipit imperdiet vel molestie orci.,In efficitur nulla nec suscipit dapibus.,Donec at quam et nunc suscipit imperdiet vel molestie orci.72, 'pub_00073',Mauris laoreet erat quis mollis porta.,"Nunc non libero tincidunt, finibus nisl a, tempor odio.",Mauris laoreet erat quis mollis porta.,"Nunc non libero tincidunt, finibus nisl a, tempor odio.",Mauris laoreet erat quis mollis porta.,"Nunc non libero tincidunt, finibus nisl a, tempor odio.",Mauris laoreet erat quis mollis porta.,"Nunc non libero tincidunt, finibus nisl a, tempor odio.",Mauris laoreet erat quis mollis porta.,"Nunc non libero tincidunt, finibus nisl a, tempor odio.",Mauris laoreet erat quis mollis porta.,"Nunc non libero tincidunt, finibus nisl a, tempor odio.",Mauris laoreet erat quis mollis porta.,"Nunc non libero tincidunt, finibus nisl a, tempor odio.",Mauris laoreet erat quis mollis porta.,"Nunc non libero tincidunt, finibus nisl a, tempor odio.",Mauris laoreet erat quis mollis porta.,"Nunc non libero tincidunt, finibus nisl a, tempor odio.",Mauris laoreet erat quis mollis porta.,"Nunc non libero tincidunt, finibus nisl a, tempor odio."73, 'pub_00075',"Ut non neque volutpat, bibendum nibh a, convallis augue.",Donec in mauris vel lectus porttitor auctor.,"Ut non neque volutpat, bibendum nibh a, convallis augue.",Donec in mauris vel lectus porttitor auctor.,"Ut non neque volutpat, bibendum nibh a, convallis augue.",Donec in mauris vel lectus porttitor auctor.,"Ut non neque volutpat, bibendum nibh a, convallis augue.",Donec in mauris vel lectus porttitor auctor.,"Ut non neque volutpat, bibendum nibh a, convallis augue.",Donec in mauris vel lectus porttitor auctor.,"Ut non neque volutpat, bibendum nibh a, convallis augue.",Donec in mauris vel lectus porttitor auctor.,"Ut non neque volutpat, bibendum nibh a, convallis augue.",Donec in mauris vel lectus porttitor auctor.,"Ut non neque volutpat, bibendum nibh a, convallis augue.",Donec in mauris vel lectus porttitor auctor.,"Ut non neque volutpat, bibendum nibh a, convallis augue.",Donec in mauris vel lectus porttitor auctor.,"Ut non neque volutpat, bibendum nibh a, convallis augue.",Donec in mauris vel lectus porttitor auctor.74, 'pub_00076',Quisque molestie tortor nec nunc pulvinar aliquet.,Integer mollis metus et bibendum accumsan.,Quisque molestie tortor nec nunc pulvinar aliquet.,Integer mollis metus et bibendum accumsan.,Quisque molestie tortor nec nunc pulvinar aliquet.,Integer mollis metus et bibendum accumsan.,Quisque molestie tortor nec nunc pulvinar aliquet.,Integer mollis metus et bibendum accumsan.,Quisque molestie tortor nec nunc pulvinar aliquet.,Integer mollis metus et bibendum accumsan.,Quisque molestie tortor nec nunc pulvinar aliquet.,Integer mollis metus et bibendum accumsan.,Quisque molestie tortor nec nunc pulvinar aliquet.,Integer mollis metus et bibendum accumsan.,Quisque molestie tortor nec nunc pulvinar aliquet.,Integer mollis metus et bibendum accumsan.,Quisque molestie tortor nec nunc pulvinar aliquet.,Integer mollis metus et bibendum accumsan.,Quisque molestie tortor nec nunc pulvinar aliquet.,Integer mollis metus et bibendum accumsan.75, 'pub_00077',Vestibulum rutrum risus at arcu lobortis pulvinar.,Etiam vitae turpis quis tortor semper sodales ut vel mauris.,Vestibulum rutrum risus at arcu lobortis pulvinar.,Etiam vitae turpis quis tortor semper sodales ut vel mauris.,Vestibulum rutrum risus at arcu lobortis pulvinar.,Etiam vitae turpis quis tortor semper sodales ut vel mauris.,Vestibulum rutrum risus at arcu lobortis pulvinar.,Etiam vitae turpis quis tortor semper sodales ut vel mauris.,Vestibulum rutrum risus at arcu lobortis pulvinar.,Etiam vitae turpis quis tortor semper sodales ut vel mauris.,Vestibulum rutrum risus at arcu lobortis pulvinar.,Etiam vitae turpis quis tortor semper sodales ut vel mauris.,Vestibulum rutrum risus at arcu lobortis pulvinar.,Etiam vitae turpis quis tortor semper sodales ut vel mauris.,Vestibulum rutrum risus at arcu lobortis pulvinar.,Etiam vitae turpis quis tortor semper sodales ut vel mauris.,Vestibulum rutrum risus at arcu lobortis pulvinar.,Etiam vitae turpis quis tortor semper sodales ut vel mauris.,Vestibulum rutrum risus at arcu lobortis pulvinar.,Etiam vitae turpis quis tortor semper sodales ut vel mauris.76, 'pub_00078',Donec at elit vel diam varius tincidunt.,"Ut vel felis sollicitudin, imperdiet tellus a, consequat velit.",Donec at elit vel diam varius tincidunt.,"Ut vel felis sollicitudin, imperdiet tellus a, consequat velit.",Donec at elit vel diam varius tincidunt.,"Ut vel felis sollicitudin, imperdiet tellus a, consequat velit.",Donec at elit vel diam varius tincidunt.,"Ut vel felis sollicitudin, imperdiet tellus a, consequat velit.",Donec at elit vel diam varius tincidunt.,"Ut vel felis sollicitudin, imperdiet tellus a, consequat velit.",Donec at elit vel diam varius tincidunt.,"Ut vel felis sollicitudin, imperdiet tellus a, consequat velit.",Donec at elit vel diam varius tincidunt.,"Ut vel felis sollicitudin, imperdiet tellus a, consequat velit.",Donec at elit vel diam varius tincidunt.,"Ut vel felis sollicitudin, imperdiet tellus a, consequat velit.",Donec at elit vel diam varius tincidunt.,"Ut vel felis sollicitudin, imperdiet tellus a, consequat velit.",Donec at elit vel diam varius tincidunt.,"Ut vel felis sollicitudin, imperdiet tellus a, consequat velit."77, 'pub_00079',Pellentesque pretium orci sit amet mi finibus pharetra.,Fusce sit amet nibh id enim convallis sodales in in nulla.,Pellentesque pretium orci sit amet mi finibus pharetra.,Fusce sit amet nibh id enim convallis sodales in in nulla.,Pellentesque pretium orci sit amet mi finibus pharetra.,Fusce sit amet nibh id enim convallis sodales in in nulla.,Pellentesque pretium orci sit amet mi finibus pharetra.,Fusce sit amet nibh id enim convallis sodales in in nulla.,Pellentesque pretium orci sit amet mi finibus pharetra.,Fusce sit amet nibh id enim convallis sodales in in nulla.,Pellentesque pretium orci sit amet mi finibus pharetra.,Fusce sit amet nibh id enim convallis sodales in in nulla.,Pellentesque pretium orci sit amet mi finibus pharetra.,Fusce sit amet nibh id enim convallis sodales in in nulla.,Pellentesque pretium orci sit amet mi finibus pharetra.,Fusce sit amet nibh id enim convallis sodales in in nulla.,Pellentesque pretium orci sit amet mi finibus pharetra.,Fusce sit amet nibh id enim convallis sodales in in nulla.,Pellentesque pretium orci sit amet mi finibus pharetra.,Fusce sit amet nibh id enim convallis sodales in in nulla.78, 'pub_00080',In malesuada leo sit amet est ornare condimentum in at dui.,Integer gravida massa tristique erat mollis hendrerit non ac turpis.,In malesuada leo sit amet est ornare condimentum in at dui.,Integer gravida massa tristique erat mollis hendrerit non ac turpis.,In malesuada leo sit amet est ornare condimentum in at dui.,Integer gravida massa tristique erat mollis hendrerit non ac turpis.,In malesuada leo sit amet est ornare condimentum in at dui.,Integer gravida massa tristique erat mollis hendrerit non ac turpis.,In malesuada leo sit amet est ornare condimentum in at dui.,Integer gravida massa tristique erat mollis hendrerit non ac turpis.,In malesuada leo sit amet est ornare condimentum in at dui.,Integer gravida massa tristique erat mollis hendrerit non ac turpis.,In malesuada leo sit amet est ornare condimentum in at dui.,Integer gravida massa tristique erat mollis hendrerit non ac turpis.,In malesuada leo sit amet est ornare condimentum in at dui.,Integer gravida massa tristique erat mollis hendrerit non ac turpis.,In malesuada leo sit amet est ornare condimentum in at dui.,Integer gravida massa tristique erat mollis hendrerit non ac turpis.,In malesuada leo sit amet est ornare condimentum in at dui.,Integer gravida massa tristique erat mollis hendrerit non ac turpis.79, 'pub_00081',Nam et ex non nisl lacinia accumsan id eu justo.,Cras vitae felis et quam rutrum facilisis.,Nam et ex non nisl lacinia accumsan id eu justo.,Cras vitae felis et quam rutrum facilisis.,Nam et ex non nisl lacinia accumsan id eu justo.,Cras vitae felis et quam rutrum facilisis.,Nam et ex non nisl lacinia accumsan id eu justo.,Cras vitae felis et quam rutrum facilisis.,Nam et ex non nisl lacinia accumsan id eu justo.,Cras vitae felis et quam rutrum facilisis.,Nam et ex non nisl lacinia accumsan id eu justo.,Cras vitae felis et quam rutrum facilisis.,Nam et ex non nisl lacinia accumsan id eu justo.,Cras vitae felis et quam rutrum facilisis.,Nam et ex non nisl lacinia accumsan id eu justo.,Cras vitae felis et quam rutrum facilisis.,Nam et ex non nisl lacinia accumsan id eu justo.,Cras vitae felis et quam rutrum facilisis.,Nam et ex non nisl lacinia accumsan id eu justo.,Cras vitae felis et quam rutrum facilisis.80, 'pub_00082',"Praesent rhoncus felis a sem bibendum, eu ultrices quam luctus.",Aliquam placerat arcu sit amet interdum bibendum.,"Praesent rhoncus felis a sem bibendum, eu ultrices quam luctus.",Aliquam placerat arcu sit amet interdum bibendum.,"Praesent rhoncus felis a sem bibendum, eu ultrices quam luctus.",Aliquam placerat arcu sit amet interdum bibendum.,"Praesent rhoncus felis a sem bibendum, eu ultrices quam luctus.",Aliquam placerat arcu sit amet interdum bibendum.,"Praesent rhoncus felis a sem bibendum, eu ultrices quam luctus.",Aliquam placerat arcu sit amet interdum bibendum.,"Praesent rhoncus felis a sem bibendum, eu ultrices quam luctus.",Aliquam placerat arcu sit amet interdum bibendum.,"Praesent rhoncus felis a sem bibendum, eu ultrices quam luctus.",Aliquam placerat arcu sit amet interdum bibendum.,"Praesent rhoncus felis a sem bibendum, eu ultrices quam luctus.",Aliquam placerat arcu sit amet interdum bibendum.,"Praesent rhoncus felis a sem bibendum, eu ultrices quam luctus.",Aliquam placerat arcu sit amet interdum bibendum.,"Praesent rhoncus felis a sem bibendum, eu ultrices quam luctus.",Aliquam placerat arcu sit amet interdum bibendum.81, 'pub_00083',Aenean ac est vitae lacus rhoncus posuere.,Donec faucibus arcu id nisi dictum fringilla.,Aenean ac est vitae lacus rhoncus posuere.,Donec faucibus arcu id nisi dictum fringilla.,Aenean ac est vitae lacus rhoncus posuere.,Donec faucibus arcu id nisi dictum fringilla.,Aenean ac est vitae lacus rhoncus posuere.,Donec faucibus arcu id nisi dictum fringilla.,Aenean ac est vitae lacus rhoncus posuere.,Donec faucibus arcu id nisi dictum fringilla.,Aenean ac est vitae lacus rhoncus posuere.,Donec faucibus arcu id nisi dictum fringilla.,Aenean ac est vitae lacus rhoncus posuere.,Donec faucibus arcu id nisi dictum fringilla.,Aenean ac est vitae lacus rhoncus posuere.,Donec faucibus arcu id nisi dictum fringilla.,Aenean ac est vitae lacus rhoncus posuere.,Donec faucibus arcu id nisi dictum fringilla.,Aenean ac est vitae lacus rhoncus posuere.,Donec faucibus arcu id nisi dictum fringilla.82, 'pub_00084',"Aliquam ut enim tempus, tincidunt felis vel, molestie odio.","Vestibulum ac nisl iaculis, laoreet ligula id, dapibus quam.","Aliquam ut enim tempus, tincidunt felis vel, molestie odio.","Vestibulum ac nisl iaculis, laoreet ligula id, dapibus quam.","Aliquam ut enim tempus, tincidunt felis vel, molestie odio.","Vestibulum ac nisl iaculis, laoreet ligula id, dapibus quam.","Aliquam ut enim tempus, tincidunt felis vel, molestie odio.","Vestibulum ac nisl iaculis, laoreet ligula id, dapibus quam.","Aliquam ut enim tempus, tincidunt felis vel, molestie odio.","Vestibulum ac nisl iaculis, laoreet ligula id, dapibus quam.","Aliquam ut enim tempus, tincidunt felis vel, molestie odio.","Vestibulum ac nisl iaculis, laoreet ligula id, dapibus quam.","Aliquam ut enim tempus, tincidunt felis vel, molestie odio.","Vestibulum ac nisl iaculis, laoreet ligula id, dapibus quam.","Aliquam ut enim tempus, tincidunt felis vel, molestie odio.","Vestibulum ac nisl iaculis, laoreet ligula id, dapibus quam.","Aliquam ut enim tempus, tincidunt felis vel, molestie odio.","Vestibulum ac nisl iaculis, laoreet ligula id, dapibus quam.","Aliquam ut enim tempus, tincidunt felis vel, molestie odio.","Vestibulum ac nisl iaculis, laoreet ligula id, dapibus quam."83, 'pub_00085',Vestibulum sodales tortor non arcu blandit vestibulum.,Proin rutrum magna sit amet diam vulputate ullamcorper.,Vestibulum sodales tortor non arcu blandit vestibulum.,Proin rutrum magna sit amet diam vulputate ullamcorper.,Vestibulum sodales tortor non arcu blandit vestibulum.,Proin rutrum magna sit amet diam vulputate ullamcorper.,Vestibulum sodales tortor non arcu blandit vestibulum.,Proin rutrum magna sit amet diam vulputate ullamcorper.,Vestibulum sodales tortor non arcu blandit vestibulum.,Proin rutrum magna sit amet diam vulputate ullamcorper.,Vestibulum sodales tortor non arcu blandit vestibulum.,Proin rutrum magna sit amet diam vulputate ullamcorper.,Vestibulum sodales tortor non arcu blandit vestibulum.,Proin rutrum magna sit amet diam vulputate ullamcorper.,Vestibulum sodales tortor non arcu blandit vestibulum.,Proin rutrum magna sit amet diam vulputate ullamcorper.,Vestibulum sodales tortor non arcu blandit vestibulum.,Proin rutrum magna sit amet diam vulputate ullamcorper.,Vestibulum sodales tortor non arcu blandit vestibulum.,Proin rutrum magna sit amet diam vulputate ullamcorper.84, 'pub_00086',"Cras finibus justo ut lorem tincidunt, ac consequat est faucibus.",Integer quis sapien vel sem pulvinar semper eget eget est.,"Cras finibus justo ut lorem tincidunt, ac consequat est faucibus.",Integer quis sapien vel sem pulvinar semper eget eget est.,"Cras finibus justo ut lorem tincidunt, ac consequat est faucibus.",Integer quis sapien vel sem pulvinar semper eget eget est.,"Cras finibus justo ut lorem tincidunt, ac consequat est faucibus.",Integer quis sapien vel sem pulvinar semper eget eget est.,"Cras finibus justo ut lorem tincidunt, ac consequat est faucibus.",Integer quis sapien vel sem pulvinar semper eget eget est.,"Cras finibus justo ut lorem tincidunt, ac consequat est faucibus.",Integer quis sapien vel sem pulvinar semper eget eget est.,"Cras finibus justo ut lorem tincidunt, ac consequat est faucibus.",Integer quis sapien vel sem pulvinar semper eget eget est.,"Cras finibus justo ut lorem tincidunt, ac consequat est faucibus.",Integer quis sapien vel sem pulvinar semper eget eget est.,"Cras finibus justo ut lorem tincidunt, ac consequat est faucibus.",Integer quis sapien vel sem pulvinar semper eget eget est.,"Cras finibus justo ut lorem tincidunt, ac consequat est faucibus.",Integer quis sapien vel sem pulvinar semper eget eget est.85, 'pub_00087',Aenean sollicitudin velit in lobortis consequat.,Proin hendrerit urna lobortis consequat ullamcorper.,Aenean sollicitudin velit in lobortis consequat.,Proin hendrerit urna lobortis consequat ullamcorper.,Aenean sollicitudin velit in lobortis consequat.,Proin hendrerit urna lobortis consequat ullamcorper.,Aenean sollicitudin velit in lobortis consequat.,Proin hendrerit urna lobortis consequat ullamcorper.,Aenean sollicitudin velit in lobortis consequat.,Proin hendrerit urna lobortis consequat ullamcorper.,Aenean sollicitudin velit in lobortis consequat.,Proin hendrerit urna lobortis consequat ullamcorper.,Aenean sollicitudin velit in lobortis consequat.,Proin hendrerit urna lobortis consequat ullamcorper.,Aenean sollicitudin velit in lobortis consequat.,Proin hendrerit urna lobortis consequat ullamcorper.,Aenean sollicitudin velit in lobortis consequat.,Proin hendrerit urna lobortis consequat ullamcorper.,Aenean sollicitudin velit in lobortis consequat.,Proin hendrerit urna lobortis consequat ullamcorper.86, 'pub_00090',Donec pulvinar diam sed arcu maximus dignissim.,Donec et urna id magna scelerisque interdum vel vel ante.,Donec pulvinar diam sed arcu maximus dignissim.,Donec et urna id magna scelerisque interdum vel vel ante.,Donec pulvinar diam sed arcu maximus dignissim.,Donec et urna id magna scelerisque interdum vel vel ante.,Donec pulvinar diam sed arcu maximus dignissim.,Donec et urna id magna scelerisque interdum vel vel ante.,Donec pulvinar diam sed arcu maximus dignissim.,Donec et urna id magna scelerisque interdum vel vel ante.,Donec pulvinar diam sed arcu maximus dignissim.,Donec et urna id magna scelerisque interdum vel vel ante.,Donec pulvinar diam sed arcu maximus dignissim.,Donec et urna id magna scelerisque interdum vel vel ante.,Donec pulvinar diam sed arcu maximus dignissim.,Donec et urna id magna scelerisque interdum vel vel ante.,Donec pulvinar diam sed arcu maximus dignissim.,Donec et urna id magna scelerisque interdum vel vel ante.,Donec pulvinar diam sed arcu maximus dignissim.,Donec et urna id magna scelerisque interdum vel vel ante.87, 'pub_00091',"Vestibulum vel ex luctus, porttitor ex nec, commodo sapien.","Nulla cursus urna non nisi tristique, id maximus massa fringilla.","Vestibulum vel ex luctus, porttitor ex nec, commodo sapien.","Nulla cursus urna non nisi tristique, id maximus massa fringilla.","Vestibulum vel ex luctus, porttitor ex nec, commodo sapien.","Nulla cursus urna non nisi tristique, id maximus massa fringilla.","Vestibulum vel ex luctus, porttitor ex nec, commodo sapien.","Nulla cursus urna non nisi tristique, id maximus massa fringilla.","Vestibulum vel ex luctus, porttitor ex nec, commodo sapien.","Nulla cursus urna non nisi tristique, id maximus massa fringilla.","Vestibulum vel ex luctus, porttitor ex nec, commodo sapien.","Nulla cursus urna non nisi tristique, id maximus massa fringilla.","Vestibulum vel ex luctus, porttitor ex nec, commodo sapien.","Nulla cursus urna non nisi tristique, id maximus massa fringilla.","Vestibulum vel ex luctus, porttitor ex nec, commodo sapien.","Nulla cursus urna non nisi tristique, id maximus massa fringilla.","Vestibulum vel ex luctus, porttitor ex nec, commodo sapien.","Nulla cursus urna non nisi tristique, id maximus massa fringilla.","Vestibulum vel ex luctus, porttitor ex nec, commodo sapien.","Nulla cursus urna non nisi tristique, id maximus massa fringilla."88, 'pub_00092',Pellentesque consequat purus ac eros pretium ultrices.,Suspendisse nec mauris eget ipsum sodales porta.,Pellentesque consequat purus ac eros pretium ultrices.,Suspendisse nec mauris eget ipsum sodales porta.,Pellentesque consequat purus ac eros pretium ultrices.,Suspendisse nec mauris eget ipsum sodales porta.,Pellentesque consequat purus ac eros pretium ultrices.,Suspendisse nec mauris eget ipsum sodales porta.,Pellentesque consequat purus ac eros pretium ultrices.,Suspendisse nec mauris eget ipsum sodales porta.,Pellentesque consequat purus ac eros pretium ultrices.,Suspendisse nec mauris eget ipsum sodales porta.,Pellentesque consequat purus ac eros pretium ultrices.,Suspendisse nec mauris eget ipsum sodales porta.,Pellentesque consequat purus ac eros pretium ultrices.,Suspendisse nec mauris eget ipsum sodales porta.,Pellentesque consequat purus ac eros pretium ultrices.,Suspendisse nec mauris eget ipsum sodales porta.,Pellentesque consequat purus ac eros pretium ultrices.,Suspendisse nec mauris eget ipsum sodales porta.