 `pub_row_index`, `pub_id`, `pub_citation`, `pub_title`, `pub_type`, `pub_link`, `pub_year`, `cohort_year`, `contributor_fids`, `pub_display`,,,,,,,,,,,,23, 'pub_00023',Ut in quam vitae tortor rutrum tempor eu nec lacus.,Sed cursus magna ac ipsum dapibus vulputate.,Ut in quam vitae tortor rutrum tempor eu nec lacus.,Sed cursus magna ac ipsum dapibus vulputate.,Ut in quam vitae tortor rutrum tempor eu nec lacus.,Sed cursus magna ac ipsum dapibus vulputate.,Ut in quam vitae tortor rutrum tempor eu nec lacus.,Sed cursus magna ac ipsum dapibus vulputate.,Ut in quam vitae tortor rutrum tempor eu nec lacus.,Sed cursus magna ac ipsum dapibus vulputate.,Ut in quam vitae tortor rutrum tempor eu nec lacus.,Sed cursus magna ac ipsum dapibus vulputate.,Ut in quam vitae tortor rutrum tempor eu nec lacus.,Sed cursus magna ac ipsum dapibus vulputate.,Ut in quam vitae tortor rutrum tempor eu nec lacus.,Sed cursus magna ac ipsum dapibus vulputate.,Ut in quam vitae tortor rutrum tempor eu nec lacus.,Sed cursus magna ac ipsum dapibus vulputate.,Ut in quam vitae tortor rutrum tempor eu nec lacus.,Sed cursus magna ac ipsum dapibus vulputate.24, 'pub_00024',"Maecenas gravida quam vel est venenatis, et venenatis dolor mollis.",Phasellus in nunc vel neque sagittis ultrices ac non odio.,"Maecenas gravida quam vel est venenatis, et venenatis dolor mollis.",Phasellus in nunc vel neque sagittis ultrices ac non odio.,"Maecenas gravida quam vel est venenatis, et venenatis dolor mollis.",Phasellus in nunc vel neque sagittis ultrices ac non odio.,"Maecenas gravida quam vel est venenatis, et venenatis dolor mollis.",Phasellus in nunc vel neque sagittis ultrices ac non odio.,"Maecenas gravida quam vel est venenatis, et venenatis dolor mollis.",Phasellus in nunc vel neque sagittis ultrices ac non odio.,"Maecenas gravida quam vel est venenatis, et venenatis dolor mollis.",Phasellus in nunc vel neque sagittis ultrices ac non odio.,"Maecenas gravida quam vel est venenatis, et venenatis dolor mollis.",Phasellus in nunc vel neque sagittis ultrices ac non odio.,"Maecenas gravida quam vel est venenatis, et venenatis dolor mollis.",Phasellus in nunc vel neque sagittis ultrices ac non odio.,"Maecenas gravida quam vel est venenatis, et venenatis dolor mollis.",Phasellus in nunc vel neque sagittis ultrices ac non odio.,"Maecenas gravida quam vel est venenatis, et venenatis dolor mollis.",Phasellus in nunc vel neque sagittis ultrices ac non odio.25, 'pub_00025',"Praesent suscipit ex nec diam luctus, nec mollis dui accumsan.",Vestibulum lacinia enim sagittis nulla porttitor consequat.,"Praesent suscipit ex nec diam luctus, nec mollis dui accumsan.",Vestibulum lacinia enim sagittis nulla porttitor consequat.,"Praesent suscipit ex nec diam luctus, nec mollis dui accumsan.",Vestibulum lacinia enim sagittis nulla porttitor consequat.,"Praesent suscipit ex nec diam luctus, nec mollis dui accumsan.",Vestibulum lacinia enim sagittis nulla porttitor consequat.,"Praesent suscipit ex nec diam luctus, nec mollis dui accumsan.",Vestibulum lacinia enim sagittis nulla porttitor consequat.,"Praesent suscipit ex nec diam luctus, nec mollis dui accumsan.",Vestibulum lacinia enim sagittis nulla porttitor consequat.,"Praesent suscipit ex nec diam luctus, nec mollis dui accumsan.",Vestibulum lacinia enim sagittis nulla porttitor consequat.,"Praesent suscipit ex nec diam luctus, nec mollis dui accumsan.",Vestibulum lacinia enim sagittis nulla porttitor consequat.,"Praesent suscipit ex nec diam luctus, nec mollis dui accumsan.",Vestibulum lacinia enim sagittis nulla porttitor consequat.,"Praesent suscipit ex nec diam luctus, nec mollis dui accumsan.",Vestibulum lacinia enim sagittis nulla porttitor consequat.26, 'pub_00026',"In et dolor ullamcorper, semper enim a, cursus tortor.","Mauris vel magna fermentum, feugiat ante in, rutrum sem.","In et dolor ullamcorper, semper enim a, cursus tortor.","Mauris vel magna fermentum, feugiat ante in, rutrum sem.","In et dolor ullamcorper, semper enim a, cursus tortor.","Mauris vel magna fermentum, feugiat ante in, rutrum sem.","In et dolor ullamcorper, semper enim a, cursus tortor.","Mauris vel magna fermentum, feugiat ante in, rutrum sem.","In et dolor ullamcorper, semper enim a, cursus tortor.","Mauris vel magna fermentum, feugiat ante in, rutrum sem.","In et dolor ullamcorper, semper enim a, cursus tortor.","Mauris vel magna fermentum, feugiat ante in, rutrum sem.","In et dolor ullamcorper, semper enim a, cursus tortor.","Mauris vel magna fermentum, feugiat ante in, rutrum sem.","In et dolor ullamcorper, semper enim a, cursus tortor.","Mauris vel magna fermentum, feugiat ante in, rutrum sem.","In et dolor ullamcorper, semper enim a, cursus tortor.","Mauris vel magna fermentum, feugiat ante in, rutrum sem.","In et dolor ullamcorper, semper enim a, cursus tortor.","Mauris vel magna fermentum, feugiat ante in, rutrum sem."27, 'pub_00027',Integer eu diam ut purus blandit tempor sed eget arcu.,Maecenas fermentum justo quis lacus sagittis consectetur.,Integer eu diam ut purus blandit tempor sed eget arcu.,Maecenas fermentum justo quis lacus sagittis consectetur.,Integer eu diam ut purus blandit tempor sed eget arcu.,Maecenas fermentum justo quis lacus sagittis consectetur.,Integer eu diam ut purus blandit tempor sed eget arcu.,Maecenas fermentum justo quis lacus sagittis consectetur.,Integer eu diam ut purus blandit tempor sed eget arcu.,Maecenas fermentum justo quis lacus sagittis consectetur.,Integer eu diam ut purus blandit tempor sed eget arcu.,Maecenas fermentum justo quis lacus sagittis consectetur.,Integer eu diam ut purus blandit tempor sed eget arcu.,Maecenas fermentum justo quis lacus sagittis consectetur.,Integer eu diam ut purus blandit tempor sed eget arcu.,Maecenas fermentum justo quis lacus sagittis consectetur.,Integer eu diam ut purus blandit tempor sed eget arcu.,Maecenas fermentum justo quis lacus sagittis consectetur.,Integer eu diam ut purus blandit tempor sed eget arcu.,Maecenas fermentum justo quis lacus sagittis consectetur.28, 'pub_00028',Curabitur interdum risus non ornare ultrices.,"Cras non augue mollis, gravida risus placerat, dapibus ex.",Curabitur interdum risus non ornare ultrices.,"Cras non augue mollis, gravida risus placerat, dapibus ex.",Curabitur interdum risus non ornare ultrices.,"Cras non augue mollis, gravida risus placerat, dapibus ex.",Curabitur interdum risus non ornare ultrices.,"Cras non augue mollis, gravida risus placerat, dapibus ex.",Curabitur interdum risus non ornare ultrices.,"Cras non augue mollis, gravida risus placerat, dapibus ex.",Curabitur interdum risus non ornare ultrices.,"Cras non augue mollis, gravida risus placerat, dapibus ex.",Curabitur interdum risus non ornare ultrices.,"Cras non augue mollis, gravida risus placerat, dapibus ex.",Curabitur interdum risus non ornare ultrices.,"Cras non augue mollis, gravida risus placerat, dapibus ex.",Curabitur interdum risus non ornare ultrices.,"Cras non augue mollis, gravida risus placerat, dapibus ex.",Curabitur interdum risus non ornare ultrices.,"Cras non augue mollis, gravida risus placerat, dapibus ex."29, 'pub_00029',Vestibulum eleifend dolor at velit laoreet fringilla.,"Donec pretium diam vitae nibh sollicitudin, in fringilla ex cursus.",Vestibulum eleifend dolor at velit laoreet fringilla.,"Donec pretium diam vitae nibh sollicitudin, in fringilla ex cursus.",Vestibulum eleifend dolor at velit laoreet fringilla.,"Donec pretium diam vitae nibh sollicitudin, in fringilla ex cursus.",Vestibulum eleifend dolor at velit laoreet fringilla.,"Donec pretium diam vitae nibh sollicitudin, in fringilla ex cursus.",Vestibulum eleifend dolor at velit laoreet fringilla.,"Donec pretium diam vitae nibh sollicitudin, in fringilla ex cursus.",Vestibulum eleifend dolor at velit laoreet fringilla.,"Donec pretium diam vitae nibh sollicitudin, in fringilla ex cursus.",Vestibulum eleifend dolor at velit laoreet fringilla.,"Donec pretium diam vitae nibh sollicitudin, in fringilla ex cursus.",Vestibulum eleifend dolor at velit laoreet fringilla.,"Donec pretium diam vitae nibh sollicitudin, in fringilla ex cursus.",Vestibulum eleifend dolor at velit laoreet fringilla.,"Donec pretium diam vitae nibh sollicitudin, in fringilla ex cursus.",Vestibulum eleifend dolor at velit laoreet fringilla.,"Donec pretium diam vitae nibh sollicitudin, in fringilla ex cursus."30, 'pub_00030',Proin fringilla velit vitae pretium malesuada.,"Integer at arcu auctor, malesuada lectus ut, porta orci.",Proin fringilla velit vitae pretium malesuada.,"Integer at arcu auctor, malesuada lectus ut, porta orci.",Proin fringilla velit vitae pretium malesuada.,"Integer at arcu auctor, malesuada lectus ut, porta orci.",Proin fringilla velit vitae pretium malesuada.,"Integer at arcu auctor, malesuada lectus ut, porta orci.",Proin fringilla velit vitae pretium malesuada.,"Integer at arcu auctor, malesuada lectus ut, porta orci.",Proin fringilla velit vitae pretium malesuada.,"Integer at arcu auctor, malesuada lectus ut, porta orci.",Proin fringilla velit vitae pretium malesuada.,"Integer at arcu auctor, malesuada lectus ut, porta orci.",Proin fringilla velit vitae pretium malesuada.,"Integer at arcu auctor, malesuada lectus ut, porta orci.",Proin fringilla velit vitae pretium malesuada.,"Integer at arcu auctor, malesuada lectus ut, porta orci.",Proin fringilla velit vitae pretium malesuada.,"Integer at arcu auctor, malesuada lectus ut, porta orci."31, 'pub_00031',"Curabitur euismod odio nec metus mattis, in mattis metus porttitor.","Nunc tempus ligula quis purus auctor, at scelerisque ex aliquet.","Curabitur euismod odio nec metus mattis, in mattis metus porttitor.","Nunc tempus ligula quis purus auctor, at scelerisque ex aliquet.","Curabitur euismod odio nec metus mattis, in mattis metus porttitor.","Nunc tempus ligula quis purus auctor, at scelerisque ex aliquet.","Curabitur euismod odio nec metus mattis, in mattis metus porttitor.","Nunc tempus ligula quis purus auctor, at scelerisque ex aliquet.","Curabitur euismod odio nec metus mattis, in mattis metus porttitor.","Nunc tempus ligula quis purus auctor, at scelerisque ex aliquet.","Curabitur euismod odio nec metus mattis, in mattis metus porttitor.","Nunc tempus ligula quis purus auctor, at scelerisque ex aliquet.","Curabitur euismod odio nec metus mattis, in mattis metus porttitor.","Nunc tempus ligula quis purus auctor, at scelerisque ex aliquet.","Curabitur euismod odio nec metus mattis, in mattis metus porttitor.","Nunc tempus ligula quis purus auctor, at scelerisque ex aliquet.","Curabitur euismod odio nec metus mattis, in mattis metus porttitor.","Nunc tempus ligula quis purus auctor, at scelerisque ex aliquet.","Curabitur euismod odio nec metus mattis, in mattis metus porttitor.","Nunc tempus ligula quis purus auctor, at scelerisque ex aliquet."32, 'pub_00032',"Donec blandit leo ac risus fermentum, ac pulvinar nulla gravida.",Curabitur ultricies magna ut quam congue consectetur.,"Donec blandit leo ac risus fermentum, ac pulvinar nulla gravida.",Curabitur ultricies magna ut quam congue consectetur.,"Donec blandit leo ac risus fermentum, ac pulvinar nulla gravida.",Curabitur ultricies magna ut quam congue consectetur.,"Donec blandit leo ac risus fermentum, ac pulvinar nulla gravida.",Curabitur ultricies magna ut quam congue consectetur.,"Donec blandit leo ac risus fermentum, ac pulvinar nulla gravida.",Curabitur ultricies magna ut quam congue consectetur.,"Donec blandit leo ac risus fermentum, ac pulvinar nulla gravida.",Curabitur ultricies magna ut quam congue consectetur.,"Donec blandit leo ac risus fermentum, ac pulvinar nulla gravida.",Curabitur ultricies magna ut quam congue consectetur.,"Donec blandit leo ac risus fermentum, ac pulvinar nulla gravida.",Curabitur ultricies magna ut quam congue consectetur.,"Donec blandit leo ac risus fermentum, ac pulvinar nulla gravida.",Curabitur ultricies magna ut quam congue consectetur.,"Donec blandit leo ac risus fermentum, ac pulvinar nulla gravida.",Curabitur ultricies magna ut quam congue consectetur.33, 'pub_00033',Nulla accumsan felis at lorem tristique varius.,"Duis vehicula nisi vitae nibh tincidunt, vulputate iaculis orci ullamcorper.",Nulla accumsan felis at lorem tristique varius.,"Duis vehicula nisi vitae nibh tincidunt, vulputate iaculis orci ullamcorper.",Nulla accumsan felis at lorem tristique varius.,"Duis vehicula nisi vitae nibh tincidunt, vulputate iaculis orci ullamcorper.",Nulla accumsan felis at lorem tristique varius.,"Duis vehicula nisi vitae nibh tincidunt, vulputate iaculis orci ullamcorper.",Nulla accumsan felis at lorem tristique varius.,"Duis vehicula nisi vitae nibh tincidunt, vulputate iaculis orci ullamcorper.",Nulla accumsan felis at lorem tristique varius.,"Duis vehicula nisi vitae nibh tincidunt, vulputate iaculis orci ullamcorper.",Nulla accumsan felis at lorem tristique varius.,"Duis vehicula nisi vitae nibh tincidunt, vulputate iaculis orci ullamcorper.",Nulla accumsan felis at lorem tristique varius.,"Duis vehicula nisi vitae nibh tincidunt, vulputate iaculis orci ullamcorper.",Nulla accumsan felis at lorem tristique varius.,"Duis vehicula nisi vitae nibh tincidunt, vulputate iaculis orci ullamcorper.",Nulla accumsan felis at lorem tristique varius.,"Duis vehicula nisi vitae nibh tincidunt, vulputate iaculis orci ullamcorper."34, 'pub_00034',"Mauris tempor purus sed magna pulvinar, non tincidunt ligula maximus.",Nunc tristique tortor vitae condimentum placerat.,"Mauris tempor purus sed magna pulvinar, non tincidunt ligula maximus.",Nunc tristique tortor vitae condimentum placerat.,"Mauris tempor purus sed magna pulvinar, non tincidunt ligula maximus.",Nunc tristique tortor vitae condimentum placerat.,"Mauris tempor purus sed magna pulvinar, non tincidunt ligula maximus.",Nunc tristique tortor vitae condimentum placerat.,"Mauris tempor purus sed magna pulvinar, non tincidunt ligula maximus.",Nunc tristique tortor vitae condimentum placerat.,"Mauris tempor purus sed magna pulvinar, non tincidunt ligula maximus.",Nunc tristique tortor vitae condimentum placerat.,"Mauris tempor purus sed magna pulvinar, non tincidunt ligula maximus.",Nunc tristique tortor vitae condimentum placerat.,"Mauris tempor purus sed magna pulvinar, non tincidunt ligula maximus.",Nunc tristique tortor vitae condimentum placerat.,"Mauris tempor purus sed magna pulvinar, non tincidunt ligula maximus.",Nunc tristique tortor vitae condimentum placerat.,"Mauris tempor purus sed magna pulvinar, non tincidunt ligula maximus.",Nunc tristique tortor vitae condimentum placerat.35, 'pub_00035',"Etiam vel quam consequat, consectetur diam vel, interdum dolor.",Quisque suscipit nunc a augue varius elementum.,"Etiam vel quam consequat, consectetur diam vel, interdum dolor.",Quisque suscipit nunc a augue varius elementum.,"Etiam vel quam consequat, consectetur diam vel, interdum dolor.",Quisque suscipit nunc a augue varius elementum.,"Etiam vel quam consequat, consectetur diam vel, interdum dolor.",Quisque suscipit nunc a augue varius elementum.,"Etiam vel quam consequat, consectetur diam vel, interdum dolor.",Quisque suscipit nunc a augue varius elementum.,"Etiam vel quam consequat, consectetur diam vel, interdum dolor.",Quisque suscipit nunc a augue varius elementum.,"Etiam vel quam consequat, consectetur diam vel, interdum dolor.",Quisque suscipit nunc a augue varius elementum.,"Etiam vel quam consequat, consectetur diam vel, interdum dolor.",Quisque suscipit nunc a augue varius elementum.,"Etiam vel quam consequat, consectetur diam vel, interdum dolor.",Quisque suscipit nunc a augue varius elementum.,"Etiam vel quam consequat, consectetur diam vel, interdum dolor.",Quisque suscipit nunc a augue varius elementum.36, 'pub_00036',Ut consequat ligula eget blandit eleifend.,Proin ac tortor sed neque feugiat hendrerit ac consectetur urna.,Ut consequat ligula eget blandit eleifend.,Proin ac tortor sed neque feugiat hendrerit ac consectetur urna.,Ut consequat ligula eget blandit eleifend.,Proin ac tortor sed neque feugiat hendrerit ac consectetur urna.,Ut consequat ligula eget blandit eleifend.,Proin ac tortor sed neque feugiat hendrerit ac consectetur urna.,Ut consequat ligula eget blandit eleifend.,Proin ac tortor sed neque feugiat hendrerit ac consectetur urna.,Ut consequat ligula eget blandit eleifend.,Proin ac tortor sed neque feugiat hendrerit ac consectetur urna.,Ut consequat ligula eget blandit eleifend.,Proin ac tortor sed neque feugiat hendrerit ac consectetur urna.,Ut consequat ligula eget blandit eleifend.,Proin ac tortor sed neque feugiat hendrerit ac consectetur urna.,Ut consequat ligula eget blandit eleifend.,Proin ac tortor sed neque feugiat hendrerit ac consectetur urna.,Ut consequat ligula eget blandit eleifend.,Proin ac tortor sed neque feugiat hendrerit ac consectetur urna.37, 'pub_00037',Suspendisse consequat libero et cursus convallis.,Sed vel lectus ut arcu aliquam fringilla.,Suspendisse consequat libero et cursus convallis.,Sed vel lectus ut arcu aliquam fringilla.,Suspendisse consequat libero et cursus convallis.,Sed vel lectus ut arcu aliquam fringilla.,Suspendisse consequat libero et cursus convallis.,Sed vel lectus ut arcu aliquam fringilla.,Suspendisse consequat libero et cursus convallis.,Sed vel lectus ut arcu aliquam fringilla.,Suspendisse consequat libero et cursus convallis.,Sed vel lectus ut arcu aliquam fringilla.,Suspendisse consequat libero et cursus convallis.,Sed vel lectus ut arcu aliquam fringilla.,Suspendisse consequat libero et cursus convallis.,Sed vel lectus ut arcu aliquam fringilla.,Suspendisse consequat libero et cursus convallis.,Sed vel lectus ut arcu aliquam fringilla.,Suspendisse consequat libero et cursus convallis.,Sed vel lectus ut arcu aliquam fringilla.38, 'pub_00038',Pellentesque at nunc quis lectus fermentum tincidunt vitae ut justo.,Curabitur cursus elit in lobortis accumsan.,Pellentesque at nunc quis lectus fermentum tincidunt vitae ut justo.,Curabitur cursus elit in lobortis accumsan.,Pellentesque at nunc quis lectus fermentum tincidunt vitae ut justo.,Curabitur cursus elit in lobortis accumsan.,Pellentesque at nunc quis lectus fermentum tincidunt vitae ut justo.,Curabitur cursus elit in lobortis accumsan.,Pellentesque at nunc quis lectus fermentum tincidunt vitae ut justo.,Curabitur cursus elit in lobortis accumsan.,Pellentesque at nunc quis lectus fermentum tincidunt vitae ut justo.,Curabitur cursus elit in lobortis accumsan.,Pellentesque at nunc quis lectus fermentum tincidunt vitae ut justo.,Curabitur cursus elit in lobortis accumsan.,Pellentesque at nunc quis lectus fermentum tincidunt vitae ut justo.,Curabitur cursus elit in lobortis accumsan.,Pellentesque at nunc quis lectus fermentum tincidunt vitae ut justo.,Curabitur cursus elit in lobortis accumsan.,Pellentesque at nunc quis lectus fermentum tincidunt vitae ut justo.,Curabitur cursus elit in lobortis accumsan.39, 'pub_00039',"Vivamus dictum enim lobortis lacus volutpat, a gravida leo mattis.","Proin a erat posuere, imperdiet dui ut, egestas mauris.","Vivamus dictum enim lobortis lacus volutpat, a gravida leo mattis.","Proin a erat posuere, imperdiet dui ut, egestas mauris.","Vivamus dictum enim lobortis lacus volutpat, a gravida leo mattis.","Proin a erat posuere, imperdiet dui ut, egestas mauris.","Vivamus dictum enim lobortis lacus volutpat, a gravida leo mattis.","Proin a erat posuere, imperdiet dui ut, egestas mauris.","Vivamus dictum enim lobortis lacus volutpat, a gravida leo mattis.","Proin a erat posuere, imperdiet dui ut, egestas mauris.","Vivamus dictum enim lobortis lacus volutpat, a gravida leo mattis.","Proin a erat posuere, imperdiet dui ut, egestas mauris.","Vivamus dictum enim lobortis lacus volutpat, a gravida leo mattis.","Proin a erat posuere, imperdiet dui ut, egestas mauris.","Vivamus dictum enim lobortis lacus volutpat, a gravida leo mattis.","Proin a erat posuere, imperdiet dui ut, egestas mauris.","Vivamus dictum enim lobortis lacus volutpat, a gravida leo mattis.","Proin a erat posuere, imperdiet dui ut, egestas mauris.","Vivamus dictum enim lobortis lacus volutpat, a gravida leo mattis.","Proin a erat posuere, imperdiet dui ut, egestas mauris."40, 'pub_00040',Nulla eget quam ac sem efficitur hendrerit id vel erat.,Vivamus condimentum eros convallis est vehicula placerat.,Nulla eget quam ac sem efficitur hendrerit id vel erat.,Vivamus condimentum eros convallis est vehicula placerat.,Nulla eget quam ac sem efficitur hendrerit id vel erat.,Vivamus condimentum eros convallis est vehicula placerat.,Nulla eget quam ac sem efficitur hendrerit id vel erat.,Vivamus condimentum eros convallis est vehicula placerat.,Nulla eget quam ac sem efficitur hendrerit id vel erat.,Vivamus condimentum eros convallis est vehicula placerat.,Nulla eget quam ac sem efficitur hendrerit id vel erat.,Vivamus condimentum eros convallis est vehicula placerat.,Nulla eget quam ac sem efficitur hendrerit id vel erat.,Vivamus condimentum eros convallis est vehicula placerat.,Nulla eget quam ac sem efficitur hendrerit id vel erat.,Vivamus condimentum eros convallis est vehicula placerat.,Nulla eget quam ac sem efficitur hendrerit id vel erat.,Vivamus condimentum eros convallis est vehicula placerat.,Nulla eget quam ac sem efficitur hendrerit id vel erat.,Vivamus condimentum eros convallis est vehicula placerat.41, 'pub_00041',"Integer efficitur tellus eu lacus aliquet, nec imperdiet ipsum iaculis.",Ut id libero vel diam consequat mollis.,"Integer efficitur tellus eu lacus aliquet, nec imperdiet ipsum iaculis.",Ut id libero vel diam consequat mollis.,"Integer efficitur tellus eu lacus aliquet, nec imperdiet ipsum iaculis.",Ut id libero vel diam consequat mollis.,"Integer efficitur tellus eu lacus aliquet, nec imperdiet ipsum iaculis.",Ut id libero vel diam consequat mollis.,"Integer efficitur tellus eu lacus aliquet, nec imperdiet ipsum iaculis.",Ut id libero vel diam consequat mollis.,"Integer efficitur tellus eu lacus aliquet, nec imperdiet ipsum iaculis.",Ut id libero vel diam consequat mollis.,"Integer efficitur tellus eu lacus aliquet, nec imperdiet ipsum iaculis.",Ut id libero vel diam consequat mollis.,"Integer efficitur tellus eu lacus aliquet, nec imperdiet ipsum iaculis.",Ut id libero vel diam consequat mollis.,"Integer efficitur tellus eu lacus aliquet, nec imperdiet ipsum iaculis.",Ut id libero vel diam consequat mollis.,"Integer efficitur tellus eu lacus aliquet, nec imperdiet ipsum iaculis.",Ut id libero vel diam consequat mollis.42, 'pub_00042',"Pellentesque vel neque fringilla, maximus quam sed, aliquet tortor.","Nam vel lacus egestas, accumsan lacus at, porttitor nisl.","Pellentesque vel neque fringilla, maximus quam sed, aliquet tortor.","Nam vel lacus egestas, accumsan lacus at, porttitor nisl.","Pellentesque vel neque fringilla, maximus quam sed, aliquet tortor.","Nam vel lacus egestas, accumsan lacus at, porttitor nisl.","Pellentesque vel neque fringilla, maximus quam sed, aliquet tortor.","Nam vel lacus egestas, accumsan lacus at, porttitor nisl.","Pellentesque vel neque fringilla, maximus quam sed, aliquet tortor.","Nam vel lacus egestas, accumsan lacus at, porttitor nisl.","Pellentesque vel neque fringilla, maximus quam sed, aliquet tortor.","Nam vel lacus egestas, accumsan lacus at, porttitor nisl.","Pellentesque vel neque fringilla, maximus quam sed, aliquet tortor.","Nam vel lacus egestas, accumsan lacus at, porttitor nisl.","Pellentesque vel neque fringilla, maximus quam sed, aliquet tortor.","Nam vel lacus egestas, accumsan lacus at, porttitor nisl.","Pellentesque vel neque fringilla, maximus quam sed, aliquet tortor.","Nam vel lacus egestas, accumsan lacus at, porttitor nisl.","Pellentesque vel neque fringilla, maximus quam sed, aliquet tortor.","Nam vel lacus egestas, accumsan lacus at, porttitor nisl."43, 'pub_00043',Aliquam in mauris rhoncus neque maximus elementum.,Etiam vulputate ante consectetur ullamcorper molestie.,Aliquam in mauris rhoncus neque maximus elementum.,Etiam vulputate ante consectetur ullamcorper molestie.,Aliquam in mauris rhoncus neque maximus elementum.,Etiam vulputate ante consectetur ullamcorper molestie.,Aliquam in mauris rhoncus neque maximus elementum.,Etiam vulputate ante consectetur ullamcorper molestie.,Aliquam in mauris rhoncus neque maximus elementum.,Etiam vulputate ante consectetur ullamcorper molestie.,Aliquam in mauris rhoncus neque maximus elementum.,Etiam vulputate ante consectetur ullamcorper molestie.,Aliquam in mauris rhoncus neque maximus elementum.,Etiam vulputate ante consectetur ullamcorper molestie.,Aliquam in mauris rhoncus neque maximus elementum.,Etiam vulputate ante consectetur ullamcorper molestie.,Aliquam in mauris rhoncus neque maximus elementum.,Etiam vulputate ante consectetur ullamcorper molestie.,Aliquam in mauris rhoncus neque maximus elementum.,Etiam vulputate ante consectetur ullamcorper molestie.44, 'pub_00044',Praesent et ex a elit luctus mollis ac in mauris.,Proin quis nisl id ante convallis hendrerit in in enim.,Praesent et ex a elit luctus mollis ac in mauris.,Proin quis nisl id ante convallis hendrerit in in enim.,Praesent et ex a elit luctus mollis ac in mauris.,Proin quis nisl id ante convallis hendrerit in in enim.,Praesent et ex a elit luctus mollis ac in mauris.,Proin quis nisl id ante convallis hendrerit in in enim.,Praesent et ex a elit luctus mollis ac in mauris.,Proin quis nisl id ante convallis hendrerit in in enim.,Praesent et ex a elit luctus mollis ac in mauris.,Proin quis nisl id ante convallis hendrerit in in enim.,Praesent et ex a elit luctus mollis ac in mauris.,Proin quis nisl id ante convallis hendrerit in in enim.,Praesent et ex a elit luctus mollis ac in mauris.,Proin quis nisl id ante convallis hendrerit in in enim.,Praesent et ex a elit luctus mollis ac in mauris.,Proin quis nisl id ante convallis hendrerit in in enim.,Praesent et ex a elit luctus mollis ac in mauris.,Proin quis nisl id ante convallis hendrerit in in enim.